mysql> create sailor(sid int,sname varchar(10),rating int,age int);
ERROR 1064 (42000): You have an error in your SQL syntax; check the manual that corresponds to your MySQL server version for the right syntax to use near 'sailor(sid int,sname varchar(10),rating int,age int)' at line 1
mysql> create database program1;
Query OK, 1 row affected (0.13 sec)

mysql> use program1;
Database changed
mysql> create sailor(sid int,sname varchar(10),rating int,age int);
ERROR 1064 (42000): You have an error in your SQL syntax; check the manual that corresponds to your MySQL server version for the right syntax to use near 'sailor(sid int,sname varchar(10),rating int,age int)' at line 1
mysql> create table sailor(sid int,sname varchar(10),rating int,age int);
Query OK, 0 rows affected (0.31 sec)

mysql> create table boat(bid integer,bname varchar(10),color varchar(10));
Query OK, 0 rows affected (0.26 sec)

mysql> create reserves(sid int,bid int,primary key(sid,bid) foreign key(sid) references silor(sid),foreign key(bid) references boat(bid));
ERROR 1064 (42000): You have an error in your SQL syntax; check the manual that corresponds to your MySQL server version for the right syntax to use near 'reserves(sid int,bid int,primary key(sid,bid) foreign key(sid) references silor(' at line 1
mysql> create reserves(sid int,bid int,primary key(sid,bid),foreign key(sid) references silor(sid),foreign key(bid) references boat(bid));
ERROR 1064 (42000): You have an error in your SQL syntax; check the manual that corresponds to your MySQL server version for the right syntax to use near 'reserves(sid int,bid int,primary key(sid,bid),foreign key(sid) references silor(' at line 1
mysql> create reserves(sid int,bid int,primary key(sid,bid),foreign key(sid) references sailor(sid),foreign key(bid) references boat(bid));
ERROR 1064 (42000): You have an error in your SQL syntax; check the manual that corresponds to your MySQL server version for the right syntax to use near 'reserves(sid int,bid int,primary key(sid,bid),foreign key(sid) references sailor' at line 1
mysql> create reserves(sid int,bid int day date,primary key(sid,bid),foreign key(sid) references sailor(sid),foreign key(bid) references boat(bid));
ERROR 1064 (42000): You have an error in your SQL syntax; check the manual that corresponds to your MySQL server version for the right syntax to use near 'reserves(sid int,bid int day date,primary key(sid,bid),foreign key(sid) referenc' at line 1
mysql> delete table sailor;
ERROR 1064 (42000): You have an error in your SQL syntax; check the manual that corresponds to your MySQL server version for the right syntax to use near 'table sailor' at line 1
mysql> delete sailor;
ERROR 1064 (42000): You have an error in your SQL syntax; check the manual that corresponds to your MySQL server version for the right syntax to use near '' at line 1
mysql> create database sailor;
Query OK, 1 row affected (0.07 sec)

mysql> ise sailor;
ERROR 1064 (42000): You have an error in your SQL syntax; check the manual that corresponds to your MySQL server version for the right syntax to use near 'ise sailor' at line 1
mysql> use sailor;
Database changed
mysql> create table sailor(sid int primary key,sname varchar(10),rating int,age int);
Query OK, 0 rows affected (0.30 sec)

mysql>  create table boat(bid integer primary key,bname varchar(10),color varchar(10));
Query OK, 0 rows affected (0.23 sec)

mysql>  create reserves(sid int,bid int day date,primary key(sid,bid),foreign key(sid) references sailor(sid),foreign key(bid) references boat(bid));
ERROR 1064 (42000): You have an error in your SQL syntax; check the manual that corresponds to your MySQL server version for the right syntax to use near 'reserves(sid int,bid int day date,primary key(sid,bid),foreign key(sid) referenc' at line 1
mysql>  create table reserves(sid int,bid int day date,primary key(sid,bid),foreign key(sid) references sailor(sid),foreign key(bid) references boat(bid));
ERROR 1064 (42000): You have an error in your SQL syntax; check the manual that corresponds to your MySQL server version for the right syntax to use near 'day date,primary key(sid,bid),foreign key(sid) references sailor(sid),foreign ke' at line 1
mysql>  create table reserves(sid int,bid,int day date,primary key(sid,bid),foreign key(sid) references sailor(sid),foreign key(bid) references boat(bid));
ERROR 1064 (42000): You have an error in your SQL syntax; check the manual that corresponds to your MySQL server version for the right syntax to use near ',int day date,primary key(sid,bid),foreign key(sid) references sailor(sid),forei' at line 1
mysql>  create table reserves(sid int,bid int,day date,primary key(sid,bid),foreign key(sid) references sailor(sid),foreign key(bid) references boat(bid));
Query OK, 0 rows affected (0.31 sec)

mysql> desc sailor;
+--------+-------------+------+-----+---------+-------+
| Field  | Type        | Null | Key | Default | Extra |
+--------+-------------+------+-----+---------+-------+
| sid    | int         | NO   | PRI | NULL    |       |
| sname  | varchar(10) | YES  |     | NULL    |       |
| rating | int         | YES  |     | NULL    |       |
| age    | int         | YES  |     | NULL    |       |
+--------+-------------+------+-----+---------+-------+
4 rows in set (0.00 sec)

mysql> desc boat;
+-------+-------------+------+-----+---------+-------+
| Field | Type        | Null | Key | Default | Extra |
+-------+-------------+------+-----+---------+-------+
| bid   | int         | NO   | PRI | NULL    |       |
| bname | varchar(10) | YES  |     | NULL    |       |
| color | varchar(10) | YES  |     | NULL    |       |
+-------+-------------+------+-----+---------+-------+
3 rows in set (0.00 sec)

mysql> desc reserves;
+-------+------+------+-----+---------+-------+
| Field | Type | Null | Key | Default | Extra |
+-------+------+------+-----+---------+-------+
| sid   | int  | NO   | PRI | NULL    |       |
| bid   | int  | NO   | PRI | NULL    |       |
| day   | date | YES  |     | NULL    |       |
+-------+------+------+-----+---------+-------+
3 rows in set (0.00 sec)

mysql> insert into sailor(sid,sname,rating,integer)values(1,'ram',5);
ERROR 1064 (42000): You have an error in your SQL syntax; check the manual that corresponds to your MySQL server version for the right syntax to use near 'integer)values(1,'ram',5)' at line 1
mysql> insert into sailor(sid,sname,rating,age)values(1,'ram',5,34);
Query OK, 1 row affected (0.03 sec)

mysql> insert into sailor(sid,sname,rating,age)values(5,'krishna',4,35);
Query OK, 1 row affected (0.06 sec)

mysql> insert into sailor(sid,sname,rating,age)values(7,'somu',5,40);
Query OK, 1 row affected (0.04 sec)

mysql> insert into sailor(sid,sname,rating,age)values(8,'raghu',7,30);
Query OK, 1 row affected (0.06 sec)

mysql> insert into sailor(sid,sname,rating,age)values(2,'shivu',6,29);
Query OK, 1 row affected (0.03 sec)

mysql> select*from sailor;
+-----+---------+--------+------+
| sid | sname   | rating | age  |
+-----+---------+--------+------+
|   1 | ram     |      5 |   34 |
|   2 | shivu   |      6 |   29 |
|   5 | krishna |      4 |   35 |
|   7 | somu    |      5 |   40 |
|   8 | raghu   |      7 |   30 |
+-----+---------+--------+------+
5 rows in set (0.00 sec)

mysql> insert into boat(bid,bname,color)values(1,'titanic','black');
Query OK, 1 row affected (0.03 sec)

mysql> insert into boat(bid,bname,color)values(5,'INS Vikram','white');
Query OK, 1 row affected (0.05 sec)

mysql> insert into boat(bid,bname,color)values(2,'INS arjun','blue');
Query OK, 1 row affected (0.04 sec)

mysql> insert into boat(bid,bname,color)values(4,'sailpacific','brown');
ERROR 1406 (22001): Data too long for column 'bname' at row 1
mysql> insert into boat(bid,bname,color)values(4,'sailpaci','brown');
Query OK, 1 row affected (0.14 sec)

mysql> insert into boat(bid,bname,color)values(7,'sailindia','peach');
Query OK, 1 row affected (0.04 sec)

mysql> select*from boat;
+-----+------------+-------+
| bid | bname      | color |
+-----+------------+-------+
|   1 | titanic    | black |
|   2 | INS arjun  | blue  |
|   4 | sailpaci   | brown |
|   5 | INS Vikram | white |
|   7 | sailindia  | peach |
+-----+------------+-------+
5 rows in set (0.00 sec)

mysql> insert into reserves(sid.bid,day)values(1,2,'2004-02-05');
ERROR 1054 (42S22): Unknown column 'sid.bid' in 'field list'
mysql> insert into reserves(sid,bid,day)values(1,2,'2004-02-05');
Query OK, 1 row affected (0.04 sec)

mysql> insert into reserves(sid,bid,day)values(2,3,'2005-01-05');
ERROR 1452 (23000): Cannot add or update a child row: a foreign key constraint fails (`sailor`.`reserves`, CONSTRAINT `reserves_ibfk_2` FOREIGN KEY (`bid`) REFERENCES `boat` (`bid`))
mysql> insert into reserves(sid,bid,day)values(2,4,'2008-02-05');
Query OK, 1 row affected (0.04 sec)

mysql> insert into reserves(sid,bid,day)values(5,5,'2010-02-05');
Query OK, 1 row affected (0.04 sec)

mysql> insert into reserves(sid,bid,day)values(7,7,'2010-02-05');
Query OK, 1 row affected (0.04 sec)

mysql> insert into reserves(sid,bid,day)values(8,1,'2011-02-05');
Query OK, 1 row affected (0.05 sec)

mysql> select* from reserves;
+-----+-----+------------+
| sid | bid | day        |
+-----+-----+------------+
|   1 |   2 | 2004-02-05 |
|   2 |   4 | 2008-02-05 |
|   5 |   5 | 2010-02-05 |
|   7 |   7 | 2010-02-05 |
|   8 |   1 | 2011-02-05 |
+-----+-----+------------+
5 rows in set (0.00 sec)

mysql> select* sname,age from sailors;
ERROR 1064 (42000): You have an error in your SQL syntax; check the manual that corresponds to your MySQL server version for the right syntax to use near 'sname,age from sailors' at line 1
mysql> select *sname,age from sailors;
ERROR 1064 (42000): You have an error in your SQL syntax; check the manual that corresponds to your MySQL server version for the right syntax to use near 'sname,age from sailors' at line 1
mysql> select sname,age from sailors;
ERROR 1146 (42S02): Table 'sailor.sailors' doesn't exist
mysql> select sname,age from sailor;
+---------+------+
| sname   | age  |
+---------+------+
| ram     |   34 |
| shivu   |   29 |
| krishna |   35 |
| somu    |   40 |
| raghu   |   30 |
+---------+------+
5 rows in set (0.00 sec)

mysql> alter table sailor rename column sname to sailor_name;
Query OK, 0 rows affected (0.23 sec)
Records: 0  Duplicates: 0  Warnings: 0

mysql> desc sailor;
+-------------+-------------+------+-----+---------+-------+
| Field       | Type        | Null | Key | Default | Extra |
+-------------+-------------+------+-----+---------+-------+
| sid         | int         | NO   | PRI | NULL    |       |
| sailor_name | varchar(10) | YES  |     | NULL    |       |
| rating      | int         | YES  |     | NULL    |       |
| age         | int         | YES  |     | NULL    |       |
+-------------+-------------+------+-----+---------+-------+
4 rows in set (0.00 sec)

mysql> select* from sailor where rating>7;
Empty set (0.00 sec)

mysql> select* from sailor where rating>5;
+-----+-------------+--------+------+
| sid | sailor_name | rating | age  |
+-----+-------------+--------+------+
|   2 | shivu       |      6 |   29 |
|   8 | raghu       |      7 |   30 |
+-----+-------------+--------+------+
2 rows in set (0.00 sec)

mysql> select * from reserves,sailor,boat where sailor.sid=reserves.sid,boat.bid=reserves.bid,boat.color='black';
ERROR 1064 (42000): You have an error in your SQL syntax; check the manual that corresponds to your MySQL server version for the right syntax to use near ',boat.bid=reserves.bid,boat.color='black'' at line 1
mysql> select * from reserves,sailor,boat where sailor.sid=reserves.sid and boat.bid=reserves.bid and boat.color='black';
+-----+-----+------------+-----+-------------+--------+------+-----+---------+-------+
| sid | bid | day        | sid | sailor_name | rating | age  | bid | bname   | color |
+-----+-----+------------+-----+-------------+--------+------+-----+---------+-------+
|   8 |   1 | 2011-02-05 |   8 | raghu       |      7 |   30 |   1 | titanic | black |
+-----+-----+------------+-----+-------------+--------+------+-----+---------+-------+
1 row in set (0.00 sec)

mysql> select color from boat,sailor,reserves where reserves.bid=boat.bid and reserves.sid=sailor.sid and sailor.name='ram';
ERROR 1054 (42S22): Unknown column 'sailor.name' in 'where clause'
mysql> select color from boat,sailor,reserves where reserves.bid=boat.bid and reserves.sid=sailor.sid and sailor.sailor_name='ram';
+-------+
| color |
+-------+
| blue  |
+-------+
1 row in set (0.00 sec)

mysql> insert into boat(bid,bname,color)values(11,'sailarabia','red');
Query OK, 1 row affected (0.21 sec)

mysql> select sailor_name from sailor,boat,reserves where sailor.sid=reserves.sid and boat.bid=reserves.bid where bid like '%7';
ERROR 1064 (42000): You have an error in your SQL syntax; check the manual that corresponds to your MySQL server version for the right syntax to use near 'where bid like '%7'' at line 1
mysql> select sailor_name from sailor,boat,reserves where sailor.sid=reserves.sid and boat.bid=reserves.bid where bid=7;
ERROR 1064 (42000): You have an error in your SQL syntax; check the manual that corresponds to your MySQL server version for the right syntax to use near 'where bid=7' at line 1
mysql> select sailor_name from sailor,boat,reserves where sailor.sid=reserves.sid and boat.bid=reserves.bid where boat.bid=7;
ERROR 1064 (42000): You have an error in your SQL syntax; check the manual that corresponds to your MySQL server version for the right syntax to use near 'where boat.bid=7' at line 1
mysql> select sailor_name from sailor,boat,reserves where sailor.sid=reserves.sid and boat.bid=reserves.bid where boat.bid=7;
ERROR 1064 (42000): You have an error in your SQL syntax; check the manual that corresponds to your MySQL server version for the right syntax to use near 'where boat.bid=7' at line 1
mysql> select sailor_name from sailor,boat,reserves where sailor.sid=reserves.sid and boat.bid=reserves.bid and boat.bid=7;
+-------------+
| sailor_name |
+-------------+
| somu        |
+-------------+
1 row in set (0.01 sec)

mysql> select sailor
    -> select sailor_name from sailor,boat,reserves where sailor.sid=reseves.sid and reserves.bid=boat.bid and boat.color='peach';
ERROR 1064 (42000): You have an error in your SQL syntax; check the manual that corresponds to your MySQL server version for the right syntax to use near 'select sailor_name from sailor,boat,reserves where sailor.sid=reseves.sid and re' at line 2
mysql> select sailor_name from sailor,boat,reserves where sailor.sid=reserves.sid and reserves.bid=boat.bid and boat.color='peach';
+-------------+
| sailor_name |
+-------------+
| somu        |
+-------------+
1 row in set (0.00 sec)

mysql> select sailor_name from sailor,boat,reserves where sailor.sid=reserves.sid and reserves.bid=boat.bid and boat.color='white';
+-------------+
| sailor_name |
+-------------+
| krishna     |
+-------------+
1 row in set (0.00 sec)

mysql> select sailor_name from sailor where sailor_name='k______%a;
    '> select sailor_name from sailor where sailor_name='k______%a;
ERROR 1064 (42000): You have an error in your SQL syntax; check the manual that corresponds to your MySQL server version for the right syntax to use near 'k______%a' at line 2
mysql> select sailor_name from sailor where sailor_name='k______%a';
Empty set (0.00 sec)

mysql> select sailor_name from sailor where sailor_name='k_____%a';
Empty set (0.00 sec)

mysql> select sailor_name from sailor where sailor_name like'k_____%a';
+-------------+
| sailor_name |
+-------------+
| krishna     |
+-------------+
1 row in set (0.03 sec)

mysql> select* from sailor where sailor.age=select MAX(age);
ERROR 1064 (42000): You have an error in your SQL syntax; check the manual that corresponds to your MySQL server version for the right syntax to use near 'select MAX(age)' at line 1
mysql> select * MAX(age) from sailor;
ERROR 1064 (42000): You have an error in your SQL syntax; check the manual that corresponds to your MySQL server version for the right syntax to use near 'MAX(age) from sailor' at line 1
mysql> select sailor_name,age fom sailor where age=(select max(age) from sailor);
ERROR 1064 (42000): You have an error in your SQL syntax; check the manual that corresponds to your MySQL server version for the right syntax to use near 'sailor where age=(select max(age) from sailor)' at line 1
mysql> select sailor_name,age fom sailor where age=(select max(age) from sailor);
ERROR 1064 (42000): You have an error in your SQL syntax; check the manual that corresponds to your MySQL server version for the right syntax to use near 'sailor where age=(select max(age) from sailor)' at line 1
mysql>
mysql> select sailor_name,age fom sailor where age=(select max(age) from sailor);
ERROR 1064 (42000): You have an error in your SQL syntax; check the manual that corresponds to your MySQL server version for the right syntax to use near 'sailor where age=(select max(age) from sailor)' at line 1
mysql> select sailor_name,age from sailor where age=(select max(age) from sailor);
+-------------+------+
| sailor_name | age  |
+-------------+------+
| somu        |   40 |
+-------------+------+
1 row in set (0.04 sec)

mysql>  commit
    -> commit;
ERROR 1064 (42000): You have an error in your SQL syntax; check the manual that corresponds to your MySQL server version for the right syntax to use near 'commit' at line 2
mysql> COMMIT;
Query OK, 0 rows affected (0.00 sec)




Insurance databse:

Enter password: ****
Welcome to the MySQL monitor.  Commands end with ; or \g.
Your MySQL connection id is 8
Server version: 8.0.34 MySQL Community Server - GPL

Copyright (c) 2000, 2023, Oracle and/or its affiliates.

Oracle is a registered trademark of Oracle Corporation and/or its
affiliates. Other names may be trademarks of their respective
owners.

Type 'help;' or '\h' for help. Type '\c' to clear the current input statement.

mysql> create database person;
Query OK, 1 row affected (0.01 sec)

mysql> use person;
Database changed
mysql> create table person(driver_id varchar(10),name char(20),address char(40));
Query OK, 0 rows affected (0.03 sec)

mysql> desc person;
+-----------+-------------+------+-----+---------+-------+
| Field     | Type        | Null | Key | Default | Extra |
+-----------+-------------+------+-----+---------+-------+
| driver_id | varchar(10) | YES  |     | NULL    |       |
| name      | char(20)    | YES  |     | NULL    |       |
| address   | char(40)    | YES  |     | NULL    |       |
+-----------+-------------+------+-----+---------+-------+
3 rows in set (0.03 sec)

mysql> delete table person;
ERROR 1064 (42000): You have an error in your SQL syntax; check the manual that corresponds to your MySQL server version for the right syntax to use near 'table person' at line 1
mysql> delete person;
ERROR 1064 (42000): You have an error in your SQL syntax; check the manual that corresponds to your MySQL server version for the right syntax to use near '' at line 1
mysql> drop table person;
Query OK, 0 rows affected (0.02 sec)

mysql> desc person;
ERROR 1146 (42S02): Table 'person.person' doesn't exist
mysql> create table person(driver_id varchar(10) primary key,name char(20),address varchar(40));
Query OK, 0 rows affected (0.02 sec)

mysql> desc person;
+-----------+-------------+------+-----+---------+-------+
| Field     | Type        | Null | Key | Default | Extra |
+-----------+-------------+------+-----+---------+-------+
| driver_id | varchar(10) | NO   | PRI | NULL    |       |
| name      | char(20)    | YES  |     | NULL    |       |
| address   | varchar(40) | YES  |     | NULL    |       |
+-----------+-------------+------+-----+---------+-------+
3 rows in set (0.00 sec)

mysql> create table car(reg_num int primary key,model varchar(10),year int);
Query OK, 0 rows affected (0.02 sec)

mysql> desc car;
+---------+-------------+------+-----+---------+-------+
| Field   | Type        | Null | Key | Default | Extra |
+---------+-------------+------+-----+---------+-------+
| reg_num | int         | NO   | PRI | NULL    |       |
| model   | varchar(10) | YES  |     | NULL    |       |
| year    | int         | YES  |     | NULL    |       |
+---------+-------------+------+-----+---------+-------+
3 rows in set (0.00 sec)

mysql> create table accident(report_num int,accident_date date,location varchar(40));
Query OK, 0 rows affected (0.02 sec)

mysql> drop table accident;
Query OK, 0 rows affected (0.02 sec)

mysql> create table accident(report_num int primary key,accident_date date,location varchar(40));
Query OK, 0 rows affected (0.01 sec)

mysql> desc accident;
+---------------+-------------+------+-----+---------+-------+
| Field         | Type        | Null | Key | Default | Extra |
+---------------+-------------+------+-----+---------+-------+
| report_num    | int         | NO   | PRI | NULL    |       |
| accident_date | date        | YES  |     | NULL    |       |
| location      | varchar(40) | YES  |     | NULL    |       |
+---------------+-------------+------+-----+---------+-------+
3 rows in set (0.00 sec)

mysql> drop table car;
Query OK, 0 rows affected (0.02 sec)

mysql> create table car(reg_num varchar(8) primary key,model varchar(10),year int);
Query OK, 0 rows affected (0.03 sec)

mysql> desc car;
+---------+-------------+------+-----+---------+-------+
| Field   | Type        | Null | Key | Default | Extra |
+---------+-------------+------+-----+---------+-------+
| reg_num | varchar(8)  | NO   | PRI | NULL    |       |
| model   | varchar(10) | YES  |     | NULL    |       |
| year    | int         | YES  |     | NULL    |       |
+---------+-------------+------+-----+---------+-------+
3 rows in set (0.00 sec)

mysql> create table owns(driver_id varchar(10),reg_num varchar(8),primary key(driver_id,reg_num),foreign key(driver_id) references person(driver_id),foreign key(reg_num) references car(reg_num);
ERROR 1064 (42000): You have an error in your SQL syntax; check the manual that corresponds to your MySQL server version for the right syntax to use near '' at line 1
mysql> create table owns(driver_id varchar(10),reg_num varchar(8),primary key(driver_id,reg_num),foreign key(driver_id) references person(driver_id),foreign key(reg_num) references car(reg_num);
ERROR 1064 (42000): You have an error in your SQL syntax; check the manual that corresponds to your MySQL server version for the right syntax to use near '' at line 1
mysql> create table owns(driver_id varchar(10),reg_num varchar(8),primary key(driver_id,reg_num),foreign key(driver_id) references person(driver_id),foreign key(reg_num) references car(reg_num));
Query OK, 0 rows affected (0.05 sec)

mysql> desc owns;
+-----------+-------------+------+-----+---------+-------+
| Field     | Type        | Null | Key | Default | Extra |
+-----------+-------------+------+-----+---------+-------+
| driver_id | varchar(10) | NO   | PRI | NULL    |       |
| reg_num   | varchar(8)  | NO   | PRI | NULL    |       |
+-----------+-------------+------+-----+---------+-------+
2 rows in set (0.00 sec)

mysql> create table participated(driver_id varchar(10),reg_num varchar(8),report_num int,damage_amount int,primary key(driver_id,reg_num,report_num),foreign key(driver_id) references person(driver_id),foreign key(reg_num) references car(reg_num),foreign key(report_num) references accident(report_num));
Query OK, 0 rows affected (0.02 sec)

mysql> desc participated;
+---------------+-------------+------+-----+---------+-------+
| Field         | Type        | Null | Key | Default | Extra |
+---------------+-------------+------+-----+---------+-------+
| driver_id     | varchar(10) | NO   | PRI | NULL    |       |
| reg_num       | varchar(8)  | NO   | PRI | NULL    |       |
| report_num    | int         | NO   | PRI | NULL    |       |
| damage_amount | int         | YES  |     | NULL    |       |
+---------------+-------------+------+-----+---------+-------+
4 rows in set (0.00 sec)
Enter password: ****
Welcome to the MySQL monitor.  Commands end with ; or \g.
Your MySQL connection id is 9
Server version: 8.0.34 MySQL Community Server - GPL

Copyright (c) 2000, 2023, Oracle and/or its affiliates.

Oracle is a registered trademark of Oracle Corporation and/or its
affiliates. Other names may be trademarks of their respective
owners.

Type 'help;' or '\h' for help. Type '\c' to clear the current input statement.

mysql> use person;
Database changed
mysql> desc person;
+-----------+-------------+------+-----+---------+-------+
| Field     | Type        | Null | Key | Default | Extra |
+-----------+-------------+------+-----+---------+-------+
| driver_id | varchar(10) | NO   | PRI | NULL    |       |
| name      | char(20)    | YES  |     | NULL    |       |
| address   | varchar(40) | YES  |     | NULL    |       |
+-----------+-------------+------+-----+---------+-------+
3 rows in set (0.00 sec)

mysql> desc car;
+---------+-------------+------+-----+---------+-------+
| Field   | Type        | Null | Key | Default | Extra |
+---------+-------------+------+-----+---------+-------+
| reg_num | varchar(8)  | NO   | PRI | NULL    |       |
| model   | varchar(10) | YES  |     | NULL    |       |
| year    | int         | YES  |     | NULL    |       |
+---------+-------------+------+-----+---------+-------+
3 rows in set (0.00 sec)

mysql> desc owns;
+-----------+-------------+------+-----+---------+-------+
| Field     | Type        | Null | Key | Default | Extra |
+-----------+-------------+------+-----+---------+-------+
| driver_id | varchar(10) | NO   | PRI | NULL    |       |
| reg_num   | varchar(8)  | NO   | PRI | NULL    |       |
+-----------+-------------+------+-----+---------+-------+
2 rows in set (0.00 sec)

mysql> desc accident;
+---------------+-------------+------+-----+---------+-------+
| Field         | Type        | Null | Key | Default | Extra |
+---------------+-------------+------+-----+---------+-------+
| report_num    | int         | NO   | PRI | NULL    |       |
| accident_date | date        | YES  |     | NULL    |       |
| location      | varchar(40) | YES  |     | NULL    |       |
+---------------+-------------+------+-----+---------+-------+
3 rows in set (0.00 sec)

mysql> desc participated;
+---------------+-------------+------+-----+---------+-------+
| Field         | Type        | Null | Key | Default | Extra |
+---------------+-------------+------+-----+---------+-------+
| driver_id     | varchar(10) | NO   | PRI | NULL    |       |
| reg_num       | varchar(8)  | NO   | PRI | NULL    |       |
| report_num    | int         | NO   | PRI | NULL    |       |
| damage_amount | int         | YES  |     | NULL    |       |
+---------------+-------------+------+-----+---------+-------+
4 rows in set (0.00 sec)

mysql> insert into person(driver_id,name,address)values('A01','Richard','Sri
nivasa Nagar');
Query OK, 1 row affected (0.02 sec)

mysql> insert into person(driver_id,name,address)values('A02\','Pradeep','Rajajinagar');
    '> insert into person(driver_id,name,address)values('A02\','Pradeep','Rajajinagar');
ERROR:
Unknown command '\''.
ERROR 1064 (42000): You have an error in your SQL syntax; check the manual that corresponds to your MySQL server version for the right syntax to use near 'Pradeep','Rajajinagar');
insert into person(driver_id,name,address)values('A02\'' at line 1
mysql> insert into person(driver_id,name,address)values('A02','Pradeep','Rajajinagar');
Query OK, 1 row affected (0.01 sec)

mysql> insert into person(driver_id,name,address)values('A03','Smith','Ashok nagar');
Query OK, 1 row affected (0.01 sec)

mysql> insert into person(driver_id,name,address)values('A04','Venu','N R colony');
Query OK, 1 row affected (0.01 sec)

mysql> insert into person(driver_id,name,address)values('A05','Jhon','Hanumanthanagar');
Query OK, 1 row affected (0.01 sec)

mysql> select * from person;
+-----------+---------+-----------------+
| driver_id | name    | address         |
+-----------+---------+-----------------+
| A01       | Richard | Srinivasa Nagar |
| A02       | Pradeep | Rajajinagar     |
| A03       | Smith   | Ashok nagar     |
| A04       | Venu    | N R colony      |
| A05       | Jhon    | Hanumanthanagar |
+-----------+---------+-----------------+
5 rows in set (0.00 sec)

mysql> insert into car(reg_num,model,year)values('KA052250','Indica',1990);
Query OK, 1 row affected (0.01 sec)

mysql> insert into car(reg_num,model,year)values('KA031181','Lancer',1957);
Query OK, 1 row affected (0.01 sec)

mysql> insert into car(reg_num,model,year)values('KA095477','Toyata',1998);
Query OK, 1 row affected (0.01 sec)

mysql> insert into car(reg_num,model,year)values('KA053408','Honda',2008);
Query OK, 1 row affected (0.01 sec)

mysql> insert into car(reg_num,model,year)values('KA041702','Audi',2005);
Query OK, 1 row affected (0.01 sec)

mysql> select * from car;
+----------+--------+------+
| reg_num  | model  | year |
+----------+--------+------+
| KA031181 | Lancer | 1957 |
| KA041702 | Audi   | 2005 |
| KA052250 | Indica | 1990 |
| KA053408 | Honda  | 2008 |
| KA095477 | Toyata | 1998 |
+----------+--------+------+
5 rows in set (0.00 sec)

mysql> insert into owns(driver_id,reg_num)values('A01','KA052250');
Query OK, 1 row affected (0.01 sec)

mysql> insert into owns(driver_id,reg_num)values('A02','KA053408');
Query OK, 1 row affected (0.01 sec)

mysql> insert into owns(driver_id,reg_num)values('A03','KA031181');
Query OK, 1 row affected (0.01 sec)

mysql> insert into owns(driver_id,reg_num)values('A04','KA095477');
Query OK, 1 row affected (0.01 sec)

mysql> insert into owns(driver_id,reg_num)values('A05','KA041702');
Query OK, 1 row affected (0.01 sec)

mysql> select * from owns;
+-----------+----------+
| driver_id | reg_num  |
+-----------+----------+
| A03       | KA031181 |
| A05       | KA041702 |
| A01       | KA052250 |
| A02       | KA053408 |
| A04       | KA095477 |
+-----------+----------+
5 rows in set (0.00 sec)

mysql> insert into accident(report_num,accicident_date,location)values(11,'2003-01-01','Mysore Road');
ERROR 1054 (42S22): Unknown column 'accicident_date' in 'field list'
mysql> insert into accident(report_num,accident_date,location)values(11,'2003-01-01','Mysore Road');
Query OK, 1 row affected (0.01 sec)

mysql> insert into accident(report_num,accident_date,location)values(12,'2004-02-02','South end circle');
Query OK, 1 row affected (0.01 sec)

mysql> insert into accident(report_num,accident_date,location)values(13,'2003-01-03','Bull Temple Road');
Query OK, 1 row affected (0.01 sec)

mysql> insert into accident(report_num,accident_date,location)values(14,'2008-02-18','Mysore Road');
Query OK, 1 row affected (0.01 sec)

mysql> insert into accident(report_num,accident_date,location)values(15,'2005-03-04','Kanakpura Road');
Query OK, 1 row affected (0.01 sec)

mysql> select * from accident;
+------------+---------------+------------------+
| report_num | accident_date | location         |
+------------+---------------+------------------+
|         11 | 2003-01-01    | Mysore Road      |
|         12 | 2004-02-02    | South end circle |
|         13 | 2003-01-03    | Bull Temple Road |
|         14 | 2008-02-18    | Mysore Road      |
|         15 | 2005-03-04    | Kanakpura Road   |
+------------+---------------+------------------+
5 rows in set (0.00 sec)

mysql> insert into participated(driver_id,reg_num,report_num,damage_amount)values('A01','KA052250',11,10000);
Query OK, 1 row affected (0.01 sec)

mysql> insert into participated(driver_id,reg_num,report_num,damage_amount)values('A02','KA053480',12,50000);
ERROR 1452 (23000): Cannot add or update a child row: a foreign key constraint fails (`person`.`participated`, CONSTRAINT `participated_ibfk_2` FOREIGN KEY (`reg_num`) REFERENCES `car` (`reg_num`))
mysql> insert into participated(driver_id,reg_num,report_num,damage_amount)values('A02','KA053480',12,50000);
ERROR 1452 (23000): Cannot add or update a child row: a foreign key constraint fails (`person`.`participated`, CONSTRAINT `participated_ibfk_2` FOREIGN KEY (`reg_num`) REFERENCES `car` (`reg_num`))
mysql> select *from participated;
+-----------+----------+------------+---------------+
| driver_id | reg_num  | report_num | damage_amount |
+-----------+----------+------------+---------------+
| A01       | KA052250 |         11 |         10000 |
+-----------+----------+------------+---------------+
1 row in set (0.00 sec)

mysql> insert into participated(driver
    -> select * from car;
ERROR 1064 (42000): You have an error in your SQL syntax; check the manual that corresponds to your MySQL server version for the right syntax to use near 'select * from car' at line 2
mysql> select *from participated;
+-----------+----------+------------+---------------+
| driver_id | reg_num  | report_num | damage_amount |
+-----------+----------+------------+---------------+
| A01       | KA052250 |         11 |         10000 |
+-----------+----------+------------+---------------+
1 row in set (0.00 sec)

mysql> insert into participated(driver_id,reg_num,report_num,damage_amount)v
alues('A02','KA053408',12,5000);
Query OK, 1 row affected (0.01 sec)

mysql> insert into participated(driver_id,reg_num,report_num,damage_amount)values('A03','KA095477',13,25000);
Query OK, 1 row affected (0.01 sec)

mysql> insert into participated(driver_id,reg_num,report_num,damage_amount)values('A04','KA031181',14,3000);
Query OK, 1 row affected (0.01 sec)

mysql> insert into participated(driver_id,reg_num,report_num,damage_amount)values('A05','KA041702',15,5000);
Query OK, 1 row affected (0.01 sec)

mysql> select * from participated;
+-----------+----------+------------+---------------+
| driver_id | reg_num  | report_num | damage_amount |
+-----------+----------+------------+---------------+
| A01       | KA052250 |         11 |         10000 |
| A02       | KA053408 |         12 |          5000 |
| A03       | KA095477 |         13 |         25000 |
| A04       | KA031181 |         14 |          3000 |
| A05       | KA041702 |         15 |          5000 |
+-----------+----------+------------+---------------+
5 rows in set (0.00 sec)

mysql> update participated set damage_amount=50000 where driver
    -> select * from participated;
ERROR 1064 (42000): You have an error in your SQL syntax; check the manual that corresponds to your MySQL server version for the right syntax to use near 'select * from participated' at line 2
mysql> update participated set damage_amount=50000 where driver_id='A02';
Query OK, 1 row affected (0.01 sec)
Rows matched: 1  Changed: 1  Warnings: 0

mysql> select * from participated;
+-----------+----------+------------+---------------+
| driver_id | reg_num  | report_num | damage_amount |
+-----------+----------+------------+---------------+
| A01       | KA052250 |         11 |         10000 |
| A02       | KA053408 |         12 |         50000 |
| A03       | KA095477 |         13 |         25000 |
| A04       | KA031181 |         14 |          3000 |
| A05       | KA041702 |         15 |          5000 |
+-----------+----------+------------+---------------+
5 rows in set (0.00 sec)

mysql> update participated set damage_amount=25000 where reg_num='KA053408';

Query OK, 1 row affected (0.01 sec)
Rows matched: 1  Changed: 1  Warnings: 0

mysql> select * from participated
    -> select * from participated;
ERROR 1064 (42000): You have an error in your SQL syntax; check the manual that corresponds to your MySQL server version for the right syntax to use near 'select * from participated' at line 2
mysql> select * from participated;;
+-----------+----------+------------+---------------+
| driver_id | reg_num  | report_num | damage_amount |
+-----------+----------+------------+---------------+
| A01       | KA052250 |         11 |         10000 |
| A02       | KA053408 |         12 |         25000 |
| A03       | KA095477 |         13 |         25000 |
| A04       | KA031181 |         14 |          3000 |
| A05       | KA041702 |         15 |          5000 |
+-----------+----------+------------+---------------+
Enter password: ****
Welcome to the MySQL monitor.  Commands end with ; or \g.
Your MySQL connection id is 10
Server version: 8.0.34 MySQL Community Server - GPL

Copyright (c) 2000, 2023, Oracle and/or its affiliates.

Oracle is a registered trademark of Oracle Corporation and/or its
affiliates. Other names may be trademarks of their respective
owners.

Type 'help;' or '\h' for help. Type '\c' to clear the current input statement.

mysql> use person;
Database changed
mysql> select * from participated;
+-----------+----------+------------+---------------+
| driver_id | reg_num  | report_num | damage_amount |
+-----------+----------+------------+---------------+
| A01       | KA052250 |         11 |         10000 |
| A02       | KA053408 |         12 |         25000 |
| A03       | KA095477 |         13 |         25000 |
| A04       | KA031181 |         14 |          3000 |
| A05       | KA041702 |         15 |          5000 |
+-----------+----------+------------+---------------+
5 rows in set (0.00 sec)

mysql> select * from accident;
+------------+---------------+------------------+
| report_num | accident_date | location         |
+------------+---------------+------------------+
|         11 | 2003-01-01    | Mysore Road      |
|         12 | 2004-02-02    | South end circle |
|         13 | 2003-01-03    | Bull Temple Road |
|         14 | 2008-02-18    | Mysore Road      |
|         15 | 2005-03-04    | Kanakpura Road   |
+------------+---------------+------------------+
5 rows in set (0.00 sec)

mysql> select * from owns;
+-----------+----------+
| driver_id | reg_num  |
+-----------+----------+
| A03       | KA031181 |
| A05       | KA041702 |
| A01       | KA052250 |
| A02       | KA053408 |
| A04       | KA095477 |
+-----------+----------+
5 rows in set (0.00 sec)

mysql> select * from cars;
ERROR 1146 (42S02): Table 'person.cars' doesn't exist
mysql> select * from car;
+----------+--------+------+
| reg_num  | model  | year |
+----------+--------+------+
| KA031181 | Lancer | 1957 |
| KA041702 | Audi   | 2005 |
| KA052250 | Indica | 1990 |
| KA053408 | Honda  | 2008 |
| KA095477 | Toyata | 1998 |
+----------+--------+------+
5 rows in set (0.00 sec)

mysql> select * from person;
+-----------+---------+-----------------+
| driver_id | name    | address         |
+-----------+---------+-----------------+
| A01       | Richard | Srinivasa Nagar |
| A02       | Pradeep | Rajajinagar     |
| A03       | Smith   | Ashok nagar     |
| A04       | Venu    | N R colony      |
| A05       | Jhon    | Hanumanthanagar |
+-----------+---------+-----------------+
5 rows in set (0.00 sec)

mysql> insert into accident(report_num,accident_date,location)values(16,'2010-05-06','Basvanagudi');
Query OK, 1 row affected (0.01 sec)

mysql> select * from accident;
+------------+---------------+------------------+
| report_num | accident_date | location         |
+------------+---------------+------------------+
|         11 | 2003-01-01    | Mysore Road      |
|         12 | 2004-02-02    | South end circle |
|         13 | 2003-01-03    | Bull Temple Road |
|         14 | 2008-02-18    | Mysore Road      |
|         15 | 2005-03-04    | Kanakpura Road   |
|         16 | 2010-05-06    | Basvanagudi      |
+------------+---------------+------------------+
6 rows in set (0.00 sec)

mysql> select count(distict driver_id)CNT from participateda,accident b where a.report_num=b.report_num and b.accident_date='2008';
ERROR 1064 (42000): You have an error in your SQL syntax; check the manual that corresponds to your MySQL server version for the right syntax to use near 'driver_id)CNT from participateda,accident b where a.report_num=b.report_num and ' at line 1
mysql> select count(distict driver_id)CNT from participated a,accident b where a.report_num=b.report_num and b.accident_date='2008';
ERROR 1064 (42000): You have an error in your SQL syntax; check the manual that corresponds to your MySQL server version for the right syntax to use near 'driver_id)CNT from participated a,accident b where a.report_num=b.report_num and' at line 1
mysql> select count(distict driver_id)CNT from participated a,accident b where a.report_num=b.report_num and b.year='2008';
ERROR 1064 (42000): You have an error in your SQL syntax; check the manual that corresponds to your MySQL server version for the right syntax to use near 'driver_id)CNT from participated a,accident b where a.report_num=b.report_num and' at line 1
mysql> select count(DISTINCT driver_id) CNT from participated a,accident b where a.report_num=b.report_num and b.year='2008';
ERROR 1054 (42S22): Unknown column 'b.year' in 'where clause'
mysql> select count(DISTINCT driver_id) CNT from participated a,accident b where a.report_num=b.report_num and b.accident_date='2008';
ERROR 1525 (HY000): Incorrect DATE value: '2008'
mysql> select count(DISTINCT driver_id) CNT from participated a,accident b where a.report_num=b.report_num and b.accident_date=2008;
+-----+
| CNT |
+-----+
|   0 |
+-----+
1 row in set, 1 warning (0.01 sec)

mysql> select count(DISTINCT driver_id) CNT from participated a,accident b where a.report_num=b.report_num and year=2008;
ERROR 1054 (42S22): Unknown column 'year' in 'where clause'
mysql> select count(DISTINCT driver_id) CNT from participated a,accident b where a.report_num=b.report_num and year='2008';
ERROR 1054 (42S22): Unknown column 'year' in 'where clause'
mysql> select count(DISTINCT driver_id) CNT from participated a,accident b where a.report_num=b.report_num and year(accident_date)='2008';
+-----+
| CNT |
+-----+
|   1 |
+-----+
1 row in set (0.01 sec)

mysql> select count(report_num) CNT from participated,car where participated.reg_num=car.reg_num and car.model='Honda';
+-----+
| CNT |
+-----+
|   1 |
+-----+
1 row in set (0.01 sec)

mysql> select * from participated order_by damage
    -> select * from participated order_by damage;
ERROR 1064 (42000): You have an error in your SQL syntax; check the manual that corresponds to your MySQL server version for the right syntax to use near 'damage
select * from participated order_by damage' at line 1
mysql> select * from participated order_by damage_amount desc;
ERROR 1064 (42000): You have an error in your SQL syntax; check the manual that corresponds to your MySQL server version for the right syntax to use near 'damage_amount desc' at line 1
mysql> select * from participated order by damage_amount desc;
+-----------+----------+------------+---------------+
| driver_id | reg_num  | report_num | damage_amount |
+-----------+----------+------------+---------------+
| A02       | KA053408 |         12 |         25000 |
| A03       | KA095477 |         13 |         25000 |
| A01       | KA052250 |         11 |         10000 |
| A05       | KA041702 |         15 |          5000 |
| A04       | KA031181 |         14 |          3000 |
+-----------+----------+------------+---------------+
5 rows in set (0.00 sec)

mysql> select avg(damange
    -> select avg(damange_amount) from participated;
ERROR 1064 (42000): You have an error in your SQL syntax; check the manual that corresponds to your MySQL server version for the right syntax to use near 'select avg(damange_amount) from participated' at line 2
mysql> select avg(damange_amount) from participated;
ERROR 1054 (42S22): Unknown column 'damange_amount' in 'field list'
mysql> select avg(damage_amount) from participated;
+--------------------+
| avg(damage_amount) |
+--------------------+
|         13600.0000 |
+--------------------+
1 row in set (0.00 sec)

mysql> select name from person a,participated b where a.driver_id=b.driver_id,b.damage_amount>(select avg(damage_amount) from participated);
ERROR 1064 (42000): You have an error in your SQL syntax; check the manual that corresponds to your MySQL server version for the right syntax to use near ',b.damage_amount>(select avg(damage_amount) from participated)' at line 1mysql> select avg(damage_amount) from participated;
+--------------------+
| avg(damage_amount) |
+--------------------+
|         13600.0000 |
+--------------------+
1 row in set (0.00 sec)

mysql> select name from person a,participated b where a.driver_id=b.driver_id and b.damage_amount>(select avg(damage_amount) from participated);
+---------+
| name    |
+---------+
| Pradeep |
| Smith   |
+---------+
2 rows in set (0.00 sec)

mysql> select max(damage_amount)from participated;
+--------------------+
| max(damage_amount) |
+--------------------+
|              25000 |
+--------------------+
1 row in set (0.00 sec)
